{"$schema":"https://json-schema.org/draft/2020-12/schema","$id":"osqar.inspector.config.v1","additionalProperties":false,"properties":{"coverage":{"additionalProperties":false,"properties":{"attestation":{"type":["string","null"]},"mapping":{"type":["string","null"]},"report":{"type":["string","null"]}},"required":["attestation","mapping","report"],"type":"object"},"doxygen":{"additionalProperties":false,"properties":{"configuration":{"type":"string"},"output":{"type":"string"},"warnings_as_errors":{"type":"boolean"}},"required":["configuration","output","warnings_as_errors"],"type":"object"},"extensions":{"patternProperties":{"^[a-z0-9]+(?:[.-][a-z0-9]+)*\\.[a-z0-9]+(?:[.-][a-z0-9]+)*$":{"type":"object"}},"type":"object","unevaluatedProperties":false},"project":{"additionalProperties":false,"properties":{"exclude":{"items":{"type":"string"},"type":"array"},"include":{"items":{"type":"string"},"type":"array"},"require_clean_git":{"type":"boolean"}},"required":["exclude","include","require_clean_git"],"type":"object"},"publication":{"additionalProperties":false,"properties":{"destination":{"type":"string"},"reproducible":{"type":"boolean"}},"required":["destination","reproducible"],"type":"object"},"schema":{"const":"osqar.inspector.config.v1"},"stages":{"additionalProperties":false,"properties":{"coverage":{"$ref":"#/$defs/stage"},"doxygen":{"$ref":"#/$defs/stage"}},"required":["coverage","doxygen"],"type":"object"}},"required":["coverage","doxygen","extensions","project","publication","schema","stages"],"title":"OSQAr Inspector configuration v1","type":"object","$defs":{"stage":{"additionalProperties":false,"properties":{"enabled":{"type":"boolean"},"required":{"type":"boolean"}},"required":["enabled","required"],"type":"object"}}}
