{"coverage":{"attestation":null,"mapping":null,"report":null},"doxygen":{"configuration":"Doxyfile","output":"build/doxygen","warnings_as_errors":false},"extensions":{},"project":{"exclude":[],"include":[],"require_clean_git":true},"publication":{"destination":"build/osqar-inspector","reproducible":true},"schema":"osqar.inspector.config.v1","stages":{"coverage":{"enabled":false,"required":false},"doxygen":{"enabled":true,"required":true}}}
